{
  "signal_id": "text_20260219_003717",
  "type": "text_insight",
  "content": "슬로 라이프는 단순히 속도를 줄이는 기술이 아니라, 인간 존재의 근원인 '내 안의 자연법칙'을 회복하려는 실존적 결단이다. 패스트 문화가 강요하는 과도함은 인간의 생체리듬을 파괴하고 정신적, 신체적 빈곤을 초래해왔다. 이에 맞서 슬로 라이프는 '적정성'이라는 척도를 세우고, 각자의 고유한 페이스를 존중하는 삶의 방식을 제안한다.[1, 7]\n본 연구를 통해 도출된 핵심은 슬로, 심플, 미니멀 라이프가 모두 '과도함에 맞서는 나다운 삶'이라는 하나의 가치로 수렴된다는 점이다. 이는 도구적으로는 적정 기술을 통해 자립성을 확보하고, 사회적으로는 슬로시티와 같은 공동체적 연대를 통해 실현된다. 비록 엘리트주의나 특권의 문제라는 비판이 존재하지만, 이는 슬로 라이프의 가치가 개인의 취향을 넘어 사회적 권리로 확장되어야 함을 역설하는 계기가 된다.[48, 49]\n결국 슬로 라이프는 우리에게 질문을 던진다. \"우리는 무엇을 위해 그토록 서두르고 있는가?\" 시계의 물리적 시간(Chronos)에 매몰된 삶에서 벗어나, 생명의 리듬이 살아 숨쉬는 적기(Kairos)의 시간을 발견할 때, 인간은 비로소 기술과 자본의 소외로부터 벗어나 진정한 자아를 마주할 수 있다. 슬로 라이프는 우리 시대의 마지막 사치나 취미가 아니라, 지속가능한 인류의 생존을 위해 회복해야 할 가장 기본적인 '삶의 문법'이다.[1, 11]",
  "captured_at": "2026-02-19T00:37:17.266783",
  "from_user": "97layer",
  "status": "analyzed",
  "analyzed_at": "2026-02-19T00:37:40.817888"
}