{
  "signal_id": "text_20260216_231642",
  "type": "text_insight",
  "content": "예전 기록 글인데 , 그냥 내가 평소 어떤 생각을 하는 사람인지, 어떤 어조와 단어를 쓰는지 파악하는 정도로 봐줘\n\n내 업에 집중하며, 내가 사랑하는 이들과 소탈하게 지내고 싶을 뿐이다만, 작금의 현실이 그 어느 때보다 나에게 뜨거운 물음표를 던진다. 요즘 벌어지는 현상, 그 이면 너머의 것을 상정하며 메모장에 조금씩 적어왔던 토막들을 그저 지금의 내가 가진 생각을 소신 있게 기록해 두려 한다.\n\nSNS는 나라는 사람을 알리는 브랜딩 수단이자 아카이브로서, 늘 그래 왔으니 말이다.\n\n어릴 때부터 무리지어 소모적인 가십거리를 주고받기보다 혼자였던 시간들이 많아서였을까. 인류의 기원이나 우주의 끝처럼 살아있는 동안 어쩌면 알 수 없는 미지의 서사들이 좋았다. 수학처럼 정해진 답이 아닌 나만의 해석으로 끝없이 상상할 수 있었으니 말이다.\n\n비롯된 태도는 우리가 눈앞에서 보고 느끼는 것들이 과연 진실이자 당연한 것일까 하며 물음표를 던지며 추론하는 것이 자연스레 일이나 일상에서 습관으로 배어왔고, 그 조각이 쌓여 내 관점을, 큰 틀에서 보면 본질적인 것을 탐구하는 가치관과 얕은 인문적 사유로 귀결되었다.\n\n그렇다고 염세적이거나 비관론자는 아니다. 영속적인 아름다움의 총체인 예술과 문학을 사랑하는 동시에, 부동산, 주식, 암호화폐 같은 지극히 세속적인 것들에도 관심이 많다.\n\n이 세속적인 것들, 즉 우리 삶의 기반이 되어주는 경제를 공부하다 보면, 그 실타래의 끝은 역사나 권력, 외교, 작게는 정책과 맞닿아 있음을 실감한다.\n\n그렇기에 내면의 안식을 원하는 내가 역설적이게도 시사와 정치에서 눈을 뗄 수 없는 이유다.\n\n노사, 세대, 성별 갈등 조장, 국방의 혼란, 불미스러운 화재 사건 사고, 그릇된 사실에 대한 침묵, 법치의 변질. 이 혼란들을 파고들다 보면 결국 사회에 더 강력한 통제의 명분을 심기 위한 것은 아닐지 하는 의문을 목도한다.\n\n피로하다.\n\n일과 운동을 할 땐 바깥세상의 소음에서 멀어지니 솔직히 요즘은 하루 온전히 쉬는 날 없는 움직임의 반복이다.\n\n잠들기 전 또 상념에 빠진다.\n\n당장 눈과 귀를 닫으면 마음이 편할까, 이미 그러기엔 지금 티비에는 비춰지지 않는 청년들의 소리가 들린다. 또 그렇지 않아 보이는 고요와 풍요를 보며 때로는 무기력하기도 하다.\n\n진격의 거인 중 케니가 했던 대사가 떠오른다.\n\n\"다들 뭔가에 취하지 않고는 버틸 수 없었던 거다.\"\n\n\"모두 무언가의 노예였다.\"\n\n인생이 그런 거겠지만 어쩌면 우리는 그 너머 낙원이라 믿었던 벽 안의 평화에 너무 오래 취해 있었는지 모른다. 스스로 책임져야 하는 자유의 무게가 버거워, 벽 밖의 진실을 마주하기보다 안전과 평등이라는 달콤한 책임의 부재에 스스로를 가두어 왔던 것은 아닐까.\n\n꼭 총과 칼을 들어야만 전쟁인 것이며, 나라가 망한다는 것이 지도에서 사라지는 것만을 의미하진 않을 것이다.\n\n그저 서서히 부의 양극화와 노력과 인내의 가치가 폄하되는 가치 상실의 시대가 되어 가는 것.\n\n벽 안의 사람들끼리 서로를 의심하고 미워하게 만드는 것. 한 사회의 정신을 무너뜨리고, 공동체의 신뢰를 파괴하며, 스스로 사고할 능력을 잃게 만드는 것들이 전쟁은 아닐지.\n\n물론 기후나 환경, 성 소수자 인권, 평등의 가치도 중요하다만 그 이전에 국가와 사회를 지탱하는 기본과 이념은 무엇일지 스스로 생각해 보아야 한다.\n\n여기서 나는 근원적으로 돌아가서 묻는다. 인류는 지금까지 어떻게 이 눈부신 문화를 이룩해 왔을까? 인간과 동물이 가진 명확한 차이는 무엇일지 생각해보면 인간이 가진 강력한 고유함은 사유하는 능력이라고 생각한다.\n\n뉴턴은 떨어지는 사과를 보며 중력을 발견하였다. 동물은 그저 떨어진 사과가 있으면 오늘의 식량일 뿐이다.\n\n즉, 이성과 지성의 차이. 당장 눈 앞이 아닌 내일과 미래를 상정할 수 있고, 추론 능력 같은 것들.\n\n하지만 현 시대는, 우리에게서 그 능력을 서서히 잠식시키고 있다. 보고 싶은 것만 볼 수 있는 촘촘히 짜여진 알고리즘의 양극화와 자극적이고 알맹이 없는 휘발적 콘텐츠, 깊이 있는 생각을 하지 않아도 되도록 편하고 풍요롭다.\n\n조금만 길어도 세 줄 요약이 필요하고 그저 소모적인 연예인들의 가십거리만을 헐뜯고 즐긴다. 자극적인 헤드라인을 맹목적으로 받아들이고, 분노하고, 편을 가르며, 서로를 향해 삿대질한다.\n\n진실은 단순한 감정이나 편향된 정보 속에 있지 않다.\n\n열린 마음과 냉철한 이성으로 본질을 바라보며 스스로 깨우쳐야 한다. 감정적 언행보다는, 한 발 물러서서 다각적으로 상황을 바라보는 감각이 더욱 필요한 때가 아닐까.\n\n자유는 공짜가 아니다.\n이 낡은 문구를, 요즘 절실히 느낀다.\n당연한 것이 아니었다. 선조들의 피로 새겨진 희생과 혈맹 위에서만 설 수 있었던 것이다. 결국 국가와 안보가 허물어지면, 우리가 사랑하는 그 어떤 문화적 활동도, 예술적 혼도 기반을 잃는다. 억압된 사회에서 진정한 자유 의지의 예술이 꽃피울 수 있을까\n나의 우려스러움이 코웃음을 사더라도 쉽사리 일어나지 않을 일이고, 이들의 행보가 진정 나라와 국익을 위한 것이며, 더 눈부신 발전을 한다면 허풍 든 사람 취급받아도 좋을 만큼 나는 이 조국을 사랑하고 더 위대한 국가로 번영하길 바랄 뿐이다.\n또한, 앞으로 이 땅에서 살아갈 날이 더 많은 우리 세대의 터전이 무망해지지 않기를, 노력한 만큼 정당한 대가를 받는 상식과 서로를 포용하는 사회이길 바랄 뿐이다.\n2025.10.01",
  "captured_at": "2026-02-16T23:16:42.598890",
  "from_user": "97layer",
  "status": "captured"
}