{
  "signal_id": "url_content_20260303_113656_e596d85f",
  "type": "url_content",
  "status": "captured",
  "content": "Underground House of the Future reinvents Chinese cave home with 3D printing\n\n<p>University of Hong Kong professors John Lin, Olivier Ottevaere and Lidia Ratoi have worked with students to overhaul an underground house in northern China, suggesting a new future for these traditional dwellings. Underground House of the Future is a complete rebuild of a house in Zhangbian Township, a village in the Loess Plateau in Henan</p>\n<p>The post <a href=\"https://www.dezeen.com/2026/03/02/underground-house-of-the-future-reinvents-chinese-cave-home-with-brick-vaults-and-3d-printing/\" rel=\"nofollow\">Underground House of the Future reinvents Chinese cave home with 3D printing</a> appeared first on <a href=\"https://www.dezeen.com\" rel=\"nofollow\">Dezeen</a>.</p>",
  "captured_at": "2026-03-03T11:36:56.078232",
  "from_user": "97layer",
  "source_channel": "crawler",
  "metadata": {
    "source_url": "https://www.dezeen.com/2026/03/02/underground-house-of-the-future-reinvents-chinese-cave-home-with-brick-vaults-and-3d-printing/",
    "title": "Underground House of the Future reinvents Chinese cave home with 3D printing",
    "crawler_source": "Dezeen",
    "category": "design_architecture",
    "language": "en",
    "published": "Mon, 02 Mar 2026 11:00:17 +0000"
  }
}