{
  "signal_id": "text_20260216_224718",
  "type": "text_insight",
  "content": "이전에 적었던 글\n\n인문학적 사유와 아틀리에\n___\nFor Slow Life Atelier WOOHWAHAE\n\n우화 해는 슬로우 라이프 양식을 기초로, 내 외면의 균형을 찾고 자신을 긍정하는 삶을 돕기 위해 시작된 브랜드입니다\n\n우리가 이야기하는 슬로우(slow) 라이프는 단순히 속도를 의미하지 않습니다. 이는 각자 생체 리듬과 생활 양식에 기초되는 것 이상의 과잉된(Fast) 허물을 덜어내고, 삶의 자연스러운 균형을 유지하며 본질에 집중하는 일종의 생활 태도입니다.\n\n마치 번데기가 자연적 흐름에 따라 나비로 우화하듯, 우화 해는 각자가 자신만의 속도로 내면의 美를 성찰하는 과정을 거치며 보다 나 다운 모습으로 생활하는 삶을 돕고자 합니다",
  "captured_at": "2026-02-16T22:47:18.509531",
  "from_user": "97layer",
  "status": "captured"
}