{
  "signal_id": "url_content_20260303_113656_b17948b3",
  "type": "url_content",
  "status": "captured",
  "content": "Italian Alpine peak topped with jagged cable car station\n\n<p>Milan-based Studio di Architettura De Carlo Gualla has created the Stella di Pila cable car station with panoramic views of the Italian Alps. Surrounded by mountains at a height of 2,723 metres, the cable car station, which tops the Aosta-Pila-Couis Gondola, was designed to be a landmark within the Alpine landscape of the Aosta Valley region.</p>\n<p>The post <a href=\"https://www.dezeen.com/2026/03/02/cablecar-de-carlo-gualla-aosta-valley-stella-di-pila/\" rel=\"nofollow\">Italian Alpine peak topped with jagged cable car station</a> appeared first on <a href=\"https://www.dezeen.com\" rel=\"nofollow\">Dezeen</a>.</p>",
  "captured_at": "2026-03-03T11:36:56.076928",
  "from_user": "97layer",
  "source_channel": "crawler",
  "metadata": {
    "source_url": "https://www.dezeen.com/2026/03/02/cablecar-de-carlo-gualla-aosta-valley-stella-di-pila/",
    "title": "Italian Alpine peak topped with jagged cable car station",
    "crawler_source": "Dezeen",
    "category": "design_architecture",
    "language": "en",
    "published": "Mon, 02 Mar 2026 11:30:32 +0000"
  }
}