{
  "signal_id": "text_20260216_232623",
  "type": "text_insight",
  "content": "이것도 있다. 전에 적은글 \n\n불완전한 기록\n\n늘 미완의 챕터들로 이어진다. 완벽한 마침표를 꿈꾸지만, 되돌아보면 어딘가 흐릿하고 번진 흔적들만이 남아있을 뿐이다. 시간은 속절없이 흘러, 붙잡으려 애쓰는 순간마저 과거의 한 장면으로 스러진다.\n\n왜 이토록 완벽을 갈망하는가. 매끈하고 빈틈없는 이상향을 좇지만, 실상은 삐걱거리고 어긋나는 불완전함의 연속이다. 젊음의 푸르름은 덧없이 퇴색하고, 찬란했던 기억조차 희미한 필름처럼 바래간다. 마치 손 안의 모래처럼, 시간은 그 어떤 강렬한 의지에도 아랑곳없이 흘러내린다.\n\n그러나, 역설적이게도 이 불완전함이야말로 삶의 가장 진솔한 기록인지 모른다. 매끄럽게 포장된 이야기 속에서는 진정한 울림을 찾기 어렵다. 오히려 군데군데 찢겨지고 얼룩진 페이지 속에서, 우리는 인간적인 고뇌와 성장의 흔적을 발견한다.\n\n완벽한 행복이나 영원한 사랑은 어쩌면 우리가 만들어낸 허상일지도 모른다. 현실은 늘 예측 불가능하고, 우리의 내면은 끊임없이 변화한다. 끝 없는 이상을 좇기보다, 지금 이 순간의 불완전함을 있는 그대로 받아들이는 것이다.\n\n모순적이게도 이 글도 완벽을 바라며 매듭지으려 하지만 그럴수록 취침시간만 늦춰질 뿐이었다\n\n무언가를 시사하기 위한 결과물이 아닌 사유의 과정 자체를 기록하였단 것에 만족할 수 있도록 해야겠다\n\n행복은 늘 가까이에",
  "captured_at": "2026-02-16T23:26:23.507984",
  "from_user": "97layer",
  "status": "captured"
}