{
  "signal_id": "url_content_20260224_093647",
  "type": "url_content",
  "status": "captured",
  "content": "Can luxury prices be justified? Industry insiders crunch the numbers.\n\nLUXURY HANDBAGS( TANNER LEATHERSTEIN, LEATHER EXPERT )$1,000 TO $5,000\n\nTake a look inside Issue Fifty-Eight.\n\nCold comfort—a style guide for convalescence.\n\nInside the artist’s atelier on the Greek island of Kea.\n\nOn a world where inherited wealth increasingly determines who gets ahead.\n\nThe full version of this story is only available for subscribers\n\nWant to enjoy full access?Subscribe Now\n\n$40 / year with 7 day free trial\n\nFour print issues of Kinfolk magazine per year, delivered to your door, with twelve-months’ access to the entire Kinfolk.com archive and all web exclusives.\n\nReceive twelve-months of all access to the entire Kinfolk.com archive and all web exclusives.\n\nAlready a Subscriber?Login\n\nCalculated at Checkout\n\nSubscribeDiscover unlimited access to Kinfolk",
  "captured_at": "2026-02-24T09:36:47.583504",
  "from_user": "97layer",
  "source_channel": "crawler",
  "metadata": {
    "title": "Accountable AspirationCan luxury prices be justified? Industry insiders crunch the numbers.",
    "source_url": "https://www.kinfolk.com/stories/accountable-aspiration/",
    "crawler_source": "Kinfolk",
    "doc_hash": "7e1158e6d1",
    "migrated_from": "wellness/20260218_Kinfolk_7e1158e6d1.md"
  }
}