{
  "signal_id": "url_content_20260303_113656_71486027",
  "type": "url_content",
  "status": "captured",
  "content": "Patrik Schumacher wins right to rename Zaha Hadid Architects\n\n<p>Zaha Hadid Architects principal Patrik Schumacher has won a legal battle with the Zaha Hadid Foundation over the use of the late Zaha Hadid's name. Last week, the Court of Appeal overruled a High Court judgement from 2014 over a licensing agreement that required the architecture studio to retain Hadid's name and pay a fee</p>\n<p>The post <a href=\"https://www.dezeen.com/2026/03/02/zaha-hadid-name-legal-battle-patrik-schumacher/\" rel=\"nofollow\">Patrik Schumacher wins right to rename Zaha Hadid Architects</a> appeared first on <a href=\"https://www.dezeen.com\" rel=\"nofollow\">Dezeen</a>.</p>",
  "captured_at": "2026-03-03T11:36:56.075608",
  "from_user": "97layer",
  "source_channel": "crawler",
  "metadata": {
    "source_url": "https://www.dezeen.com/2026/03/02/zaha-hadid-name-legal-battle-patrik-schumacher/",
    "title": "Patrik Schumacher wins right to rename Zaha Hadid Architects",
    "crawler_source": "Dezeen",
    "category": "design_architecture",
    "language": "en",
    "published": "Mon, 02 Mar 2026 14:00:47 +0000"
  }
}