{
  "signal_id": "text_20260220_182136",
  "type": "text_insight",
  "content": "paris_lab_24시간\n...\n+\n프랑스 여성들에게는 묘한 공통점이 있다. 머리는 방금\n자다 깨 듯 헝클어져 있고 화장기는 거의 없는데. 낡은\n트렌치코트 하나를 걸쳐도 압도적으로 우아하다. 일명 !e\nne sais quoi(형언할 수 없는 어떤 것)' 완벽하게 세팅된\n아이돌의 아름다움과는 대척점에 있다. 마케팅에서는 이를\n'결핍의 미학'이라 부를 수 있다. 완벽함은 모방\n가능하지만, 자연스러운 불완전함은 흉내 낼 수 없기\n때문이다. 럭셔리 브랜딩도 마찬가지다. 로고로 온몸을\n도배한 완벽한 세팅보다. 낡은 에르메스 켈리백을\n장바구니처럼 무심하게 드는 태도. 파리는 전 세계에\n'애쓰지 않는 태도(Effortless)' 그 자체가 가장 비싼\n럭셔리라는 것을 기가 막히게 팔고 있다. 결국 최고의\n브랜딩은 '나 이렇게 멋져'라고 소리치는 게 아니라. 그저\n묵묵히 자신의 라이프스타일을 지켜나가는 데서 나온다\n(유치한 비유지만) 드래곤볼의 프리저도, 셀도 변신\n3단계는 2단계보다 벌크도 작고 평범한 것처럼 말이다",
  "captured_at": "2026-02-20T18:21:36.663702",
  "from_user": "97layer",
  "status": "analyzed",
  "analyzed_at": "2026-02-20T18:22:10.663009"
}