{
  "signal_id": "url_content_20260224_093647",
  "type": "url_content",
  "status": "captured",
  "content": "Photo:  Courtesy of Kintzing.\n\n( 1 ) The Coalition for Better Ads was founded in 2016. Though presented as an effort to improve the online experience, its formation was largely driven by industry fears that the rise of ad-blockers threatened the digital advertising ecosystem.\n\nThere once was a time when commercials were prized for their artistic merit, and meant to be enjoyed. Yet the recent rise of streaming services and social media platforms has given way to another approach, where companies see ads less as an expression of brand identity, and more as a way to encourage users to sign up for new subscription tiers.\n\nNetflix launched its less expensive, ad-supported tier in 2022; Instagram added ads to its search results a year later, and soon after, YouTube began introducing 30 seconds of unskippable ads to accompany certain videos. As a result, streamers and services are being incentivized to show more ads, for longer, with many users complaining that they have become dull, disruptive and repetitive. In other words, what was once an art form is now engineered as an annoyance.\n\nThis new relationship to ads has come a long way since the internet’s first banner—a simple, small rectangle promoting AT&T on the former online magazineHotWiredin 1994. In part, this is down to digital platforms reducing their ad prices, allowing companies with smaller budgets a chance at the prime spots. Today’s digital come-ons are often cheaply made or AI-generated, jarring or misleading, and strategically placed to interrupt the video or article you are trying to enjoy.1\n\nRegardless of quality, a 2018 study by music streaming service Pandora, authored by the California-based company alongside scientists from Netflix and Uber, found that when users are faced with countless ads, they are more likely to convert to an ad-free subscription. The success of such tactics—creating a diminished experience that customers can pay to fix—has seen many other services follow suit. Some of the biggest dating apps, such as Hinge, Bumble and Tinder, now limit the number of people you can express interest in, how visible you are to others, or even the type of matches you receive until you opt into a premium service. Users of Duolingo are now also required to pay to remove the presence of timed ads after every lesson in the language learning app.\n\nTake a look inside Issue Fifty-Eight.\n\nCold comfort—a style guide for convalescence.\n\nInside the artist’s atelier on the Greek island of Kea.\n\nOn a world where inherited wealth increasingly determines who gets ahead.\n\nThe full version of this story is only available for subscribers\n\nWant to enjoy full access?Subscribe Now\n\n$40 / year with 7 day free trial\n\nFour print issues of Kinfolk magazine per year, delivered to your door, with twelve-months’ access to the entire Kinfolk.com archive and all web exclusives.\n\nReceive twelve-months of all access to the entire Kinfolk.com archive and all web exclusives.\n\nAlready a Subscriber?Login\n\nCalculated",
  "captured_at": "2026-02-24T09:36:47.561701",
  "from_user": "97layer",
  "source_channel": "crawler",
  "metadata": {
    "title": "The Price of PeaceOn the rise of the annoyance economy.",
    "source_url": "https://www.kinfolk.com/stories/the-price-of-peace/",
    "crawler_source": "Kinfolk",
    "doc_hash": "562216f95a",
    "migrated_from": "wellness/20260218_Kinfolk_562216f95a.md"
  }
}