{
  "signal_id": "url_content_20260224_093647",
  "type": "url_content",
  "status": "captured",
  "content": "Three Shanghai creatives each reflect on a failing that shaped their futures.\n\nFRISO HSIAO: FOUNDER OF DESSERT RESTAURANT ENDO\n\nTake a look inside Issue Fifty-Eight.\n\nCold comfort—a style guide for convalescence.\n\nInside the artist’s atelier on the Greek island of Kea.\n\nOn a world where inherited wealth increasingly determines who gets ahead.\n\nThe full version of this story is only available for subscribers\n\nWant to enjoy full access?Subscribe Now\n\n$40 / year with 7 day free trial\n\nFour print issues of Kinfolk magazine per year, delivered to your door, with twelve-months’ access to the entire Kinfolk.com archive and all web exclusives.\n\nReceive twelve-months of all access to the entire Kinfolk.com archive and all web exclusives.\n\nAlready a Subscriber?Login\n\nCalculated at Checkout\n\nSubscribeDiscover unlimited access to Kinfolk",
  "captured_at": "2026-02-24T09:36:47.595750",
  "from_user": "97layer",
  "source_channel": "crawler",
  "metadata": {
    "title": "Expensive MistakesThree Shanghai creatives each reflect on a failing that  shaped their futures.",
    "source_url": "https://www.kinfolk.com/stories/expensive-mistakes/",
    "crawler_source": "Kinfolk",
    "doc_hash": "f572289a4a",
    "migrated_from": "wellness/20260218_Kinfolk_f572289a4a.md"
  }
}